{"candidates":[{"ambiguity_shape_kinds":[],"candidate_id":"3f7c843b-b7d8-4903-9405-c1d2a82d4738","contour_points":[{"evidenceKind":"mesh","evidenceRef":"mesh_anchor:B1BCCEF0-2AF3-46E3-AA9D-0D28F1EF09FC","position":{"x":0,"y":0}}],"coordinate_space_id":"893addc6-b4b6-4cb4-8da2-67c64765ffa5","derivation_algorithm":"wall-fit","derivation_version":"1.0.0","fit_score":0.9,"geometry":{"orientedRectangle":{"center":{"x":1,"y":2},"depth":4,"headingRadians":0.5,"width":3}},"normalized_residual":0.1,"observation_end_seconds":5,"observation_start_seconds":1,"record_kind":"object","resolution":"resolved","shape_kind":"oriented_rectangle","source_evidence_refs":["mesh_anchor:B1BCCEF0-2AF3-46E3-AA9D-0D28F1EF09FC"],"source_mode":"classified_mesh","support_score":0.8},{"ambiguity_shape_kinds":[],"candidate_id":"94a47925-da76-41e6-a3f7-509b14ebd096","contour_points":[{"evidenceKind":"scene_depth","evidenceRef":"path:evidence/depth/bf05816a-4d99-4bd4-ad0f-b807a22f6f82.depthbin","position":{"x":2,"y":2}}],"coordinate_space_id":"893addc6-b4b6-4cb4-8da2-67c64765ffa5","derivation_algorithm":"targeted-object-fit","derivation_version":"1.0.0","fit_score":0.85,"geometry":{"circle":{"center":{"x":2,"y":2},"radius":0.4}},"normalized_residual":0.15,"observation_end_seconds":14,"observation_start_seconds":10,"record_kind":"object","resolution":"resolved","shape_kind":"circle","source_evidence_refs":["path:evidence/depth/bf05816a-4d99-4bd4-ad0f-b807a22f6f82.depthbin"],"source_mode":"scene_depth","support_score":0.75}],"capture_revision_id":"81e4985b-3169-49a4-b76c-8316a7145117","capture_session_id":"0f936474-e29d-415d-9691-b52faed6227b","schema":"htdt.capture.derived-geometry-candidates","schema_version":"1.0.0"}